{
  "schema_version": 2,
  "compiler_version": "scenario-compiler-python-v2-corpus-20261020",
  "runtime_contract": "story-runtime-v2",
  "scenario_id": "1_5_001tom_1_5_001_00_3",
  "text_catalog_id": "1_5_001tom_1_5_001_00_3",
  "text_contract_version": 1,
  "source": {
    "raw_path": "RAW/asset/scenario_1_5.unity3d",
    "raw_hash": "sha256:65592b1ef6033340c69326e77ecd9f3222edaf5c771a2a43ed3057f566491ef1"
  },
  "steps": [
    {
      "step_id": 1,
      "type": "synopsis",
      "entry_snapshot": {
        "bg": null,
        "bg_effect": null,
        "bg_transition": null,
        "bg_effects": [],
        "bg_profile": null,
        "bgm": null,
        "bgm_volume": 100,
        "se": null,
        "se_events": [],
        "environmental": null,
        "spines": [],
        "talk_mode": false,
        "phone_mode": false,
        "camera_zoom": null,
        "screen_fade": null,
        "screen_slide": null,
        "screen_effects": [],
        "bgm_stop_fade": null,
        "environmental_volume": null,
        "environmental_duck_target": null,
        "bgm_delay": null,
        "bgm_stop_delay": null,
        "environmental_stop_delay": null,
        "environmental_ducking_delay": null,
        "camera_filter": null,
        "camera_filter_transition": null,
        "bg_color": null,
        "bg_dof": null,
        "bg_color_transition": null,
        "bg_dof_transition": null,
        "text_disabled": false,
        "image_icon": null,
        "screen_overlay": {
          "kind": "fade",
          "visible": true,
          "color": "#000000",
          "alpha": 1
        }
      },
      "settled_snapshot": {
        "bg": null,
        "bg_effect": null,
        "bg_transition": null,
        "bg_effects": [],
        "bg_profile": null,
        "bgm": null,
        "bgm_volume": 100,
        "se": null,
        "se_events": [],
        "environmental": null,
        "spines": [],
        "talk_mode": false,
        "phone_mode": false,
        "camera_zoom": null,
        "screen_fade": null,
        "screen_slide": null,
        "screen_effects": [],
        "bgm_stop_fade": null,
        "environmental_volume": null,
        "environmental_duck_target": null,
        "bgm_delay": null,
        "bgm_stop_delay": null,
        "environmental_stop_delay": null,
        "environmental_ducking_delay": null,
        "camera_filter": null,
        "camera_filter_transition": null,
        "bg_color": null,
        "bg_dof": null,
        "bg_color_transition": null,
        "bg_dof_transition": null,
        "text_disabled": false,
        "image_icon": null,
        "screen_overlay": {
          "kind": "fade",
          "visible": true,
          "color": "#000000",
          "alpha": 1
        }
      },
      "snapshot_format": "story-snapshot-v2",
      "cues": [],
      "flow": {
        "advance": "user",
        "blocks_skip": false,
        "choice_id": null
      },
      "evidence": {
        "source_file": "assets/resources/scenariodata/1_5_001tom/scenario_1_5_001_00_3.json",
        "source_part_id": "1_5_001_00_3",
        "command_start": 0,
        "command_end": 0,
        "raw_type": "text_synopsis",
        "confidence": "exact"
      },
      "dialogue": {
        "speaker_identity": {
          "kind": "none",
          "entity_type": null,
          "entity_id": null,
          "source_name": ""
        },
        "source_text": "【あらすじ】",
        "text_ref": {
          "unit_id": "story-text:v1:1_5_001tom_1_5_001_00_3:1_5_001_00_3:cmd-000000:synopsis:000",
          "source": {
            "scenario_id": "1_5_001tom_1_5_001_00_3",
            "part_id": "1_5_001_00_3",
            "file": "assets/resources/scenariodata/1_5_001tom/scenario_1_5_001_00_3.json",
            "command_index": 0,
            "field_kind": "synopsis",
            "field_ordinal": 0
          },
          "source_hash": "sha256:b5d3e8fa043af75a87dd4faef01ce8885090903c7489ecb33e70005fc16c71c5"
        },
        "speaker_source_text": "お仕事開始",
        "speaker_text_ref": {
          "unit_id": "story-text:v1:1_5_001tom_1_5_001_00_3:1_5_001_00_3:cmd-000000:title:000",
          "source": {
            "scenario_id": "1_5_001tom_1_5_001_00_3",
            "part_id": "1_5_001_00_3",
            "file": "assets/resources/scenariodata/1_5_001tom/scenario_1_5_001_00_3.json",
            "command_index": 0,
            "field_kind": "title",
            "field_ordinal": 0
          },
          "source_hash": "sha256:c9578f41f04512f8dd518c9243e386d3dec69c30c8930a99faa1eaef07ea0ceb"
        }
      }
    },
    {
      "step_id": 2,
      "type": "fadeout",
      "entry_snapshot": {
        "bg": "bg001_315pro_in_01",
        "bg_effect": null,
        "bg_transition": null,
        "bg_effects": [],
        "bg_profile": {
          "imageId": "bg001_315pro_in_01",
          "lightPosition": 1,
          "lightCoordinate": {
            "x": 0.0,
            "y": 0.0
          },
          "lightAlpha": 1.0,
          "colorOffSet": {
            "x": 0.0,
            "y": 0.0,
            "z": 0.0
          },
          "colorScale": {
            "x": 1.0,
            "y": 1.0,
            "z": 1.0
          },
          "colorSaturation": 1.0
        },
        "bgm": "usual_day",
        "bgm_volume": 100,
        "se": null,
        "se_events": [],
        "environmental": {
          "cue": "ambi_room"
        },
        "spines": [],
        "talk_mode": false,
        "phone_mode": false,
        "camera_zoom": null,
        "screen_fade": {
          "type": "in",
          "duration": 0.5,
          "delay": 0.0,
          "color": "#000000"
        },
        "screen_slide": null,
        "screen_effects": [],
        "bgm_stop_fade": null,
        "environmental_volume": null,
        "environmental_duck_target": null,
        "bgm_delay": null,
        "bgm_stop_delay": null,
        "environmental_stop_delay": null,
        "environmental_ducking_delay": null,
        "camera_filter": null,
        "camera_filter_transition": null,
        "bg_color": null,
        "bg_dof": null,
        "bg_color_transition": null,
        "bg_dof_transition": null,
        "text_disabled": false,
        "image_icon": null,
        "screen_overlay": {
          "kind": "fade",
          "visible": true,
          "color": "#000000",
          "alpha": 1
        }
      },
      "settled_snapshot": {
        "bg": "bg001_315pro_in_01",
        "bg_effect": null,
        "bg_transition": null,
        "bg_effects": [],
        "bg_profile": {
          "imageId": "bg001_315pro_in_01",
          "lightPosition": 1,
          "lightCoordinate": {
            "x": 0.0,
            "y": 0.0
          },
          "lightAlpha": 1.0,
          "colorOffSet": {
            "x": 0.0,
            "y": 0.0,
            "z": 0.0
          },
          "colorScale": {
            "x": 1.0,
            "y": 1.0,
            "z": 1.0
          },
          "colorSaturation": 1.0
        },
        "bgm": "usual_day",
        "bgm_volume": 100,
        "se": null,
        "se_events": [],
        "environmental": {
          "cue": "ambi_room"
        },
        "spines": [],
        "talk_mode": false,
        "phone_mode": false,
        "camera_zoom": null,
        "screen_fade": null,
        "screen_slide": null,
        "screen_effects": [],
        "bgm_stop_fade": null,
        "environmental_volume": null,
        "environmental_duck_target": null,
        "bgm_delay": null,
        "bgm_stop_delay": null,
        "environmental_stop_delay": null,
        "environmental_ducking_delay": null,
        "camera_filter": null,
        "camera_filter_transition": null,
        "bg_color": null,
        "bg_dof": null,
        "bg_color_transition": null,
        "bg_dof_transition": null,
        "text_disabled": false,
        "image_icon": null,
        "screen_overlay": null
      },
      "snapshot_format": "story-snapshot-v2",
      "cues": [
        {
          "cue_id": "step-2:000:screen-fade",
          "at": 0,
          "duration": 0.5,
          "channel": "screen",
          "action": "screen.fade",
          "target": "screen-overlay",
          "payload": {
            "type": "in",
            "color": "#000000",
            "alpha": 1
          },
          "lifecycle": {
            "persistence": "transient",
            "skippable": true,
            "blocks_input": false,
            "blocks_auto": true,
            "restore_policy": "settled"
          },
          "evidence": {
            "source_file": "assets/resources/scenariodata/1_5_001tom/scenario_1_5_001_00_3.json",
            "source_part_id": "1_5_001_00_3",
            "command_start": 9,
            "command_end": 9,
            "raw_type": "screen_fadeout",
            "confidence": "derived",
            "parser_rule": "legacy:state.screen_fade"
          }
        }
      ],
      "flow": {
        "advance": "user",
        "blocks_skip": false,
        "choice_id": null
      },
      "evidence": {
        "source_file": "assets/resources/scenariodata/1_5_001tom/scenario_1_5_001_00_3.json",
        "source_part_id": "1_5_001_00_3",
        "command_start": 9,
        "command_end": 9,
        "raw_type": "screen_fadeout",
        "confidence": "exact"
      },
      "post_wait": 0.5
    },
    {
      "step_id": 3,
      "type": "stage",
      "entry_snapshot": {
        "bg": "bg001_315pro_in_01",
        "bg_effect": null,
        "bg_transition": null,
        "bg_effects": [],
        "bg_profile": {
          "imageId": "bg001_315pro_in_01",
          "lightPosition": 1,
          "lightCoordinate": {
            "x": 0.0,
            "y": 0.0
          },
          "lightAlpha": 1.0,
          "colorOffSet": {
            "x": 0.0,
            "y": 0.0,
            "z": 0.0
          },
          "colorScale": {
            "x": 1.0,
            "y": 1.0,
            "z": 1.0
          },
          "colorSaturation": 1.0